<?xml version="1.0" encoding="UTF-8" ?>
<simpleFlow flowName="testProcess" flowDesc="测试流程" xmlns="http://simple-flow.hunk.com"
            xmlns:xsi="http://www.w3.org/2001/XMLSchema-instance"
            xsi:schemaLocation="http://simple-flow.hunk.com simple-flow-xml2.xsd">
    <nodes>
        <start beanId="checkFlow" nodeDesc="参数校验"/>
        <node beanId="flowOne" nodeDesc="流程1"/>
        <node beanId="flowTwo" nodeDesc="流程2"/>
        <node beanId="flowThree" nodeDesc="流程3"/>
        <node beanId="flowFour" nodeDesc="流程4"/>
        <end beanId="flowEnd" nodeDesc="流程结束"/>
    </nodes>

    <lines>
        <line conditionDesc="流程1" condition="${ paramOne} eq 'true' " from="checkFlow" to="flowOne"/>
        <line conditionDesc="流程3" condition="${ paramTwo} eq '1'" from="flowOne" to="flowThree"/>
        <line conditionDesc="流程4" condition="${ paramTwo} eq '2'" from="flowOne" to="flowFour"/>

        <line conditionDesc="流程2" condition=" empty (${paramOne}) or ${paramOne} ne 'true' " from="checkFlow" to="flowTwo"/>
        <line conditionDesc="流程3" condition="${ paramTwo} eq '1' " from="flowTwo" to="flowThree"/>
        <line conditionDesc="流程4" condition="${ paramTwo} eq '2' " from="flowTwo" to="flowFour"/>

        <line conditionDesc="流程结束" condition="${ paramOne} eq 'true' " from="flowThree" to="flowEnd"/>
        <line conditionDesc="流程结束" condition="${ paramOne} eq 'true' " from="flowFour" to="flowEnd"/>
    </lines>
</simpleFlow>
